<?xml version="1.0" encoding="UTF-8"?>

<Authorization xmlns:xsi="http://www.w3.org/2001/XMLSchema-instance" xsi:noNamespaceSchemaLocation="users_role_mapping.xsd">  
  <AclActorList> 
    <AclActor id="Admin" type="group"> 
      <Info>Administrator</Info>  
      <AclMember type="user">lsfadmin</AclMember>  
      <AclMember type="user">Admin</AclMember>  
    </AclActor>  
    <AclActor id="VipUser" type="group"> 
      <Info>VIP User</Info> 
    </AclActor>  
    <AclActor id="OrgLeader" type="group"> 
      <Info>Org Leader</Info> 
    </AclActor>  
    <AclActor id="DepLeader" type="group"> 
      <Info>Dep Leader</Info> 
    </AclActor>  
    <AclActor id="CommonUser" type="group"> 
      <Info>Common User</Info>  
      <AclMember type="user">user1</AclMember>
    </AclActor> 
  </AclActorList> 
</Authorization>
